{
  "schema_version": 2,
  "descriptor_grammar": "limit:key | limit:key:<int> | boolean:key",
  "id": "platform_v2",
  "name": "liwan Platform",
  "description": "Complete-policy revision of the platform composition baseline. Every tier inherits the core tier's limit set, which now includes an explicit zero branch ceiling (limit:branches.extra_limit:0, default-deny) next to the two operator-set limits. Names, prices and other numeric ceilings remain pending decisions.",
  "industry": "none",
  "base_modules": [
    "liwan_core",
    "liwan_platform",
    "liwan_api"
  ],
  "tiers": [
    {
      "id": "core",
      "name": "Core",
      "description": "Base modules only: the platform, its capability catalog and the shared API.",
      "modules": [],
      "features": [
        "limit:users.limit",
        "limit:storage.limit_mb",
        "limit:branches.extra_limit:0"
      ]
    },
    {
      "id": "projects",
      "name": "Projects",
      "description": "Adds the project and meeting pillar over the base modules.",
      "modules": [
        "liwan_pmo",
        "liwan_meetings"
      ],
      "features": [
        "boolean:pmo.enabled",
        "boolean:meetings.enabled",
        "limit:projects.max_projects"
      ]
    },
    {
      "id": "people",
      "name": "People",
      "description": "Adds the HR pillar over the base modules.",
      "modules": [
        "liwan_hr"
      ],
      "features": [
        "boolean:hr.enabled"
      ]
    },
    {
      "id": "messaging",
      "name": "Messaging",
      "description": "Adds the member-private chat pillar over the base modules.",
      "modules": [
        "liwan_chat"
      ],
      "features": [
        "boolean:chat.enabled"
      ]
    }
  ]
}
